id,name,rating,number_of_rooms,available_rooms,price_per_night,amenities,description,place_id
244,Pfeffer-Reichel,2,38,2,44664,cum sociis natoque penatibus et magnis dis parturient,Phasellus in felis. Donec semper sapien a libero. Nam dui.,15
245,"Rice, Swift and Carroll",3,92,2,70877,amet consectetuer adipiscing elit proin risus,"In sagittis dui vel nisl. Duis ac nibh. Fusce lacus purus, aliquet at, feugiat non, pretium quis, lectus.

Suspendisse potenti. In eleifend quam a odio. In hac habitasse platea dictumst.",177
246,Feeney-Daugherty,1,82,3,94664,neque duis bibendum morbi non quam nec,Phasellus in felis. Donec semper sapien a libero. Nam dui.,686
247,Dach-Bernhard,5,32,3,58133,ut suscipit a feugiat et,"Cum sociis natoque penatibus et magnis dis parturient montes, nascetur ridiculus mus. Vivamus vestibulum sagittis sapien. Cum sociis natoque penatibus et magnis dis parturient montes, nascetur ridiculus mus.",857
248,"Balistreri, Carroll and Kshlerin",4,58,2,31742,ut odio cras mi pede malesuada,"Proin eu mi. Nulla ac enim. In tempor, turpis nec euismod scelerisque, quam turpis adipiscing lorem, vitae mattis nibh ligula nec sem.",800
249,Erdman and Sons,5,33,4,73795,tincidunt nulla mollis molestie lorem,"Etiam vel augue. Vestibulum rutrum rutrum neque. Aenean auctor gravida sem.

Praesent id massa id nisl venenatis lacinia. Aenean sit amet justo. Morbi ut odio.",864
250,Conroy and Sons,3,68,3,28691,nulla suscipit ligula in lacus curabitur at ipsum,Aenean lectus. Pellentesque eget nunc. Donec quis orci eget orci vehicula condimentum.,853
251,Hegmann Group,4,82,3,44826,sed interdum venenatis turpis enim,"Aenean fermentum. Donec ut mauris eget massa tempor convallis. Nulla neque libero, convallis eget, eleifend luctus, ultricies eu, nibh.

Quisque id justo sit amet sapien dignissim vestibulum. Vestibulum ante ipsum primis in faucibus orci luctus et ultrices posuere cubilia Curae; Nulla dapibus dolor vel est. Donec odio justo, sollicitudin ut, suscipit a, feugiat et, eros.",233
252,Bruen-Crooks,3,65,5,21620,ut dolor morbi vel lectus in,"Cras non velit nec nisi vulputate nonummy. Maecenas tincidunt lacus at velit. Vivamus vel nulla eget eros elementum pellentesque.

Quisque porta volutpat erat. Quisque erat eros, viverra eget, congue eget, semper rutrum, nulla. Nunc purus.

Phasellus in felis. Donec semper sapien a libero. Nam dui.",852
253,Dach and Sons,3,37,2,87969,curabitur gravida nisi at nibh,"Integer ac leo. Pellentesque ultrices mattis odio. Donec vitae nisi.

Nam ultrices, libero non mattis pulvinar, nulla pede ullamcorper augue, a suscipit nulla elit ac nulla. Sed vel enim sit amet nunc viverra dapibus. Nulla suscipit ligula in lacus.",630
254,Kemmer and Sons,3,61,5,22992,ac consequat metus sapien ut nunc,"Duis consequat dui nec nisi volutpat eleifend. Donec ut dolor. Morbi vel lectus in quam fringilla rhoncus.

Mauris enim leo, rhoncus sed, vestibulum sit amet, cursus id, turpis. Integer aliquet, massa id lobortis convallis, tortor risus dapibus augue, vel accumsan tellus nisi eu orci. Mauris lacinia sapien quis libero.",82
255,Gusikowski and Sons,1,98,2,85227,mi pede malesuada in imperdiet et commodo vulputate,"Phasellus in felis. Donec semper sapien a libero. Nam dui.

Proin leo odio, porttitor id, consequat in, consequat ut, nulla. Sed accumsan felis. Ut at dolor quis odio consequat varius.",441
256,"Swift, Boyle and Kirlin",3,86,2,30569,mi in porttitor pede justo eu,"Vestibulum ac est lacinia nisi venenatis tristique. Fusce congue, diam id ornare imperdiet, sapien urna pretium nisl, ut volutpat sapien arcu sed augue. Aliquam erat volutpat.",679
257,Daniel-Bartell,1,95,2,34457,in leo maecenas pulvinar lobortis,"Fusce consequat. Nulla nisl. Nunc nisl.

Duis bibendum, felis sed interdum venenatis, turpis enim blandit mi, in porttitor pede justo eu massa. Donec dapibus. Duis at velit eu est congue elementum.

In hac habitasse platea dictumst. Morbi vestibulum, velit id pretium iaculis, diam erat fermentum justo, nec condimentum neque sapien placerat ante. Nulla justo.",34
258,"Bednar, Rice and Ratke",2,91,3,72593,sit amet eros suspendisse accumsan,"Aenean lectus. Pellentesque eget nunc. Donec quis orci eget orci vehicula condimentum.

Curabitur in libero ut massa volutpat convallis. Morbi odio odio, elementum eu, interdum eu, tincidunt in, leo. Maecenas pulvinar lobortis est.

Phasellus sit amet erat. Nulla tempus. Vivamus in felis eu sapien cursus vestibulum.",168
259,"Cassin, Morissette and Vandervort",1,80,5,52389,fusce posuere felis sed lacus morbi sem,"Vestibulum ac est lacinia nisi venenatis tristique. Fusce congue, diam id ornare imperdiet, sapien urna pretium nisl, ut volutpat sapien arcu sed augue. Aliquam erat volutpat.

In congue. Etiam justo. Etiam pretium iaculis justo.",814
260,Pollich-Buckridge,4,83,3,35342,faucibus orci luctus et ultrices posuere cubilia curae,"Donec diam neque, vestibulum eget, vulputate ut, ultrices vel, augue. Vestibulum ante ipsum primis in faucibus orci luctus et ultrices posuere cubilia Curae; Donec pharetra, magna vestibulum aliquet ultrices, erat tortor sollicitudin mi, sit amet lobortis sapien sapien non mi. Integer ac neque.

Duis bibendum. Morbi non quam nec dui luctus rutrum. Nulla tellus.",446
261,"Mills, Hansen and Nader",2,29,4,9566,amet nunc viverra dapibus nulla suscipit ligula in,"Quisque porta volutpat erat. Quisque erat eros, viverra eget, congue eget, semper rutrum, nulla. Nunc purus.

Phasellus in felis. Donec semper sapien a libero. Nam dui.",622
262,Huels and Sons,3,57,4,93847,sed justo pellentesque viverra pede,"Quisque id justo sit amet sapien dignissim vestibulum. Vestibulum ante ipsum primis in faucibus orci luctus et ultrices posuere cubilia Curae; Nulla dapibus dolor vel est. Donec odio justo, sollicitudin ut, suscipit a, feugiat et, eros.

Vestibulum ac est lacinia nisi venenatis tristique. Fusce congue, diam id ornare imperdiet, sapien urna pretium nisl, ut volutpat sapien arcu sed augue. Aliquam erat volutpat.",609
263,Zieme-Glover,2,25,3,6713,at vulputate vitae nisl aenean lectus pellentesque eget,"Fusce consequat. Nulla nisl. Nunc nisl.

Duis bibendum, felis sed interdum venenatis, turpis enim blandit mi, in porttitor pede justo eu massa. Donec dapibus. Duis at velit eu est congue elementum.",868
264,Orn-Schuppe,1,70,1,63140,at nunc commodo placerat praesent blandit nam nulla,"Nulla ut erat id mauris vulputate elementum. Nullam varius. Nulla facilisi.

Cras non velit nec nisi vulputate nonummy. Maecenas tincidunt lacus at velit. Vivamus vel nulla eget eros elementum pellentesque.

Quisque porta volutpat erat. Quisque erat eros, viverra eget, congue eget, semper rutrum, nulla. Nunc purus.",922
265,Breitenberg-Bartoletti,5,26,1,98495,penatibus et magnis dis parturient montes,"In congue. Etiam justo. Etiam pretium iaculis justo.

In hac habitasse platea dictumst. Etiam faucibus cursus urna. Ut tellus.",481
266,"Ratke, Runolfsdottir and Little",1,80,3,63147,erat id mauris vulputate elementum,"Maecenas leo odio, condimentum id, luctus nec, molestie sed, justo. Pellentesque viverra pede ac diam. Cras pellentesque volutpat dui.",638
267,Mohr-Ankunding,4,86,4,49462,justo aliquam quis turpis eget elit,Aenean lectus. Pellentesque eget nunc. Donec quis orci eget orci vehicula condimentum.,348
268,Robel-Wilderman,4,24,4,65516,neque duis bibendum morbi non quam nec,"Quisque id justo sit amet sapien dignissim vestibulum. Vestibulum ante ipsum primis in faucibus orci luctus et ultrices posuere cubilia Curae; Nulla dapibus dolor vel est. Donec odio justo, sollicitudin ut, suscipit a, feugiat et, eros.

Vestibulum ac est lacinia nisi venenatis tristique. Fusce congue, diam id ornare imperdiet, sapien urna pretium nisl, ut volutpat sapien arcu sed augue. Aliquam erat volutpat.",642
269,"Kuhic, Olson and Stokes",4,37,2,12849,at lorem integer tincidunt ante vel ipsum praesent,"Nam ultrices, libero non mattis pulvinar, nulla pede ullamcorper augue, a suscipit nulla elit ac nulla. Sed vel enim sit amet nunc viverra dapibus. Nulla suscipit ligula in lacus.",473
270,Dooley-Stehr,4,86,4,96462,adipiscing elit proin interdum mauris non ligula pellentesque,"Suspendisse potenti. In eleifend quam a odio. In hac habitasse platea dictumst.

Maecenas ut massa quis augue luctus tincidunt. Nulla mollis molestie lorem. Quisque ut erat.",134
271,Stamm Inc,2,26,4,45924,eget semper rutrum nulla nunc purus phasellus in,"Aenean fermentum. Donec ut mauris eget massa tempor convallis. Nulla neque libero, convallis eget, eleifend luctus, ultricies eu, nibh.",274
272,Carter Group,5,34,1,83083,erat vestibulum sed magna at nunc commodo placerat,"Curabitur in libero ut massa volutpat convallis. Morbi odio odio, elementum eu, interdum eu, tincidunt in, leo. Maecenas pulvinar lobortis est.",372
273,Maggio Inc,5,50,3,69498,pretium iaculis justo in hac habitasse platea dictumst,"Quisque porta volutpat erat. Quisque erat eros, viverra eget, congue eget, semper rutrum, nulla. Nunc purus.

Phasellus in felis. Donec semper sapien a libero. Nam dui.",929
274,"Senger, Beer and Von",3,41,5,81548,augue luctus tincidunt nulla mollis molestie lorem quisque,"Duis bibendum, felis sed interdum venenatis, turpis enim blandit mi, in porttitor pede justo eu massa. Donec dapibus. Duis at velit eu est congue elementum.",810
275,"Will, Schowalter and Schimmel",4,59,1,225,turpis integer aliquet massa id lobortis,"Quisque id justo sit amet sapien dignissim vestibulum. Vestibulum ante ipsum primis in faucibus orci luctus et ultrices posuere cubilia Curae; Nulla dapibus dolor vel est. Donec odio justo, sollicitudin ut, suscipit a, feugiat et, eros.

Vestibulum ac est lacinia nisi venenatis tristique. Fusce congue, diam id ornare imperdiet, sapien urna pretium nisl, ut volutpat sapien arcu sed augue. Aliquam erat volutpat.

In congue. Etiam justo. Etiam pretium iaculis justo.",12
276,Walsh and Sons,2,35,5,98533,ante vestibulum ante ipsum primis,"Maecenas leo odio, condimentum id, luctus nec, molestie sed, justo. Pellentesque viverra pede ac diam. Cras pellentesque volutpat dui.",236
277,"DuBuque, Thompson and Reichert",1,63,1,21485,aenean lectus pellentesque eget nunc donec,"Aenean fermentum. Donec ut mauris eget massa tempor convallis. Nulla neque libero, convallis eget, eleifend luctus, ultricies eu, nibh.

Quisque id justo sit amet sapien dignissim vestibulum. Vestibulum ante ipsum primis in faucibus orci luctus et ultrices posuere cubilia Curae; Nulla dapibus dolor vel est. Donec odio justo, sollicitudin ut, suscipit a, feugiat et, eros.",280
278,Koepp-Roberts,1,34,3,636,pede ullamcorper augue a suscipit nulla elit,"Quisque porta volutpat erat. Quisque erat eros, viverra eget, congue eget, semper rutrum, nulla. Nunc purus.

Phasellus in felis. Donec semper sapien a libero. Nam dui.",28
279,Ebert-Kuhn,1,35,2,29529,ac enim in tempor turpis nec euismod,"Duis bibendum, felis sed interdum venenatis, turpis enim blandit mi, in porttitor pede justo eu massa. Donec dapibus. Duis at velit eu est congue elementum.

In hac habitasse platea dictumst. Morbi vestibulum, velit id pretium iaculis, diam erat fermentum justo, nec condimentum neque sapien placerat ante. Nulla justo.

Aliquam quis turpis eget elit sodales scelerisque. Mauris sit amet eros. Suspendisse accumsan tortor quis turpis.",434
280,Lehner-Brakus,4,28,4,33400,sem praesent id massa id nisl venenatis lacinia,"Duis consequat dui nec nisi volutpat eleifend. Donec ut dolor. Morbi vel lectus in quam fringilla rhoncus.

Mauris enim leo, rhoncus sed, vestibulum sit amet, cursus id, turpis. Integer aliquet, massa id lobortis convallis, tortor risus dapibus augue, vel accumsan tellus nisi eu orci. Mauris lacinia sapien quis libero.",783
281,Braun LLC,3,96,4,64480,fusce congue diam id ornare imperdiet sapien urna,"Praesent blandit. Nam nulla. Integer pede justo, lacinia eget, tincidunt eget, tempus vel, pede.",996
282,"Waters, Becker and Braun",2,77,2,79499,sed lacus morbi sem mauris laoreet ut,"Nam ultrices, libero non mattis pulvinar, nulla pede ullamcorper augue, a suscipit nulla elit ac nulla. Sed vel enim sit amet nunc viverra dapibus. Nulla suscipit ligula in lacus.

Curabitur at ipsum ac tellus semper interdum. Mauris ullamcorper purus sit amet nulla. Quisque arcu libero, rutrum ac, lobortis vel, dapibus at, diam.",95
283,McLaughlin Group,3,84,1,80571,mauris enim leo rhoncus sed vestibulum sit,Fusce consequat. Nulla nisl. Nunc nisl.,311
284,"Mayert, Rosenbaum and Watsica",5,87,2,71602,accumsan tortor quis turpis sed,"Aenean fermentum. Donec ut mauris eget massa tempor convallis. Nulla neque libero, convallis eget, eleifend luctus, ultricies eu, nibh.

Quisque id justo sit amet sapien dignissim vestibulum. Vestibulum ante ipsum primis in faucibus orci luctus et ultrices posuere cubilia Curae; Nulla dapibus dolor vel est. Donec odio justo, sollicitudin ut, suscipit a, feugiat et, eros.

Vestibulum ac est lacinia nisi venenatis tristique. Fusce congue, diam id ornare imperdiet, sapien urna pretium nisl, ut volutpat sapien arcu sed augue. Aliquam erat volutpat.",960
285,Funk-Dooley,5,45,4,80917,mauris laoreet ut rhoncus aliquet pulvinar,"Maecenas leo odio, condimentum id, luctus nec, molestie sed, justo. Pellentesque viverra pede ac diam. Cras pellentesque volutpat dui.",967
286,Flatley Inc,1,80,4,18292,cubilia curae duis faucibus accumsan odio,"Proin leo odio, porttitor id, consequat in, consequat ut, nulla. Sed accumsan felis. Ut at dolor quis odio consequat varius.",385
287,Windler-Rogahn,1,29,5,72841,molestie hendrerit at vulputate vitae nisl,"Vestibulum ac est lacinia nisi venenatis tristique. Fusce congue, diam id ornare imperdiet, sapien urna pretium nisl, ut volutpat sapien arcu sed augue. Aliquam erat volutpat.

In congue. Etiam justo. Etiam pretium iaculis justo.",917
288,"Yundt, Cronin and Lynch",4,95,4,68114,sapien in sapien iaculis congue vivamus,"Proin leo odio, porttitor id, consequat in, consequat ut, nulla. Sed accumsan felis. Ut at dolor quis odio consequat varius.

Integer ac leo. Pellentesque ultrices mattis odio. Donec vitae nisi.",674
289,Mayert and Sons,4,78,1,96717,consequat in consequat ut nulla sed accumsan,Nullam porttitor lacus at turpis. Donec posuere metus vitae ipsum. Aliquam non mauris.,93
290,"Schulist, O'Reilly and Parisian",2,89,3,76972,vel ipsum praesent blandit lacinia erat vestibulum,"Sed sagittis. Nam congue, risus semper porta volutpat, quam pede lobortis ligula, sit amet eleifend pede libero quis orci. Nullam molestie nibh in lectus.

Pellentesque at nulla. Suspendisse potenti. Cras in purus eu magna vulputate luctus.",186
291,Hackett LLC,4,60,3,57061,adipiscing molestie hendrerit at vulputate vitae,"Maecenas ut massa quis augue luctus tincidunt. Nulla mollis molestie lorem. Quisque ut erat.

Curabitur gravida nisi at nibh. In hac habitasse platea dictumst. Aliquam augue quam, sollicitudin vitae, consectetuer eget, rutrum at, lorem.",209
292,Bartoletti Group,4,20,4,82682,neque libero convallis eget eleifend luctus ultricies,"Aliquam quis turpis eget elit sodales scelerisque. Mauris sit amet eros. Suspendisse accumsan tortor quis turpis.

Sed ante. Vivamus tortor. Duis mattis egestas metus.

Aenean fermentum. Donec ut mauris eget massa tempor convallis. Nulla neque libero, convallis eget, eleifend luctus, ultricies eu, nibh.",148
293,"Bogan, Thiel and Hand",4,59,4,38211,feugiat et eros vestibulum ac est lacinia,"Morbi non lectus. Aliquam sit amet diam in magna bibendum imperdiet. Nullam orci pede, venenatis non, sodales sed, tincidunt eu, felis.

Fusce posuere felis sed lacus. Morbi sem mauris, laoreet ut, rhoncus aliquet, pulvinar sed, nisl. Nunc rhoncus dui vel sem.",825
294,"Ankunding, Pfeffer and Klein",1,52,5,54297,eu orci mauris lacinia sapien quis libero,"Phasellus in felis. Donec semper sapien a libero. Nam dui.

Proin leo odio, porttitor id, consequat in, consequat ut, nulla. Sed accumsan felis. Ut at dolor quis odio consequat varius.",452
295,"Lockman, Price and Jacobson",1,54,4,78998,nisi vulputate nonummy maecenas tincidunt,"Proin eu mi. Nulla ac enim. In tempor, turpis nec euismod scelerisque, quam turpis adipiscing lorem, vitae mattis nibh ligula nec sem.",1000
296,Hirthe LLC,4,45,2,61981,porttitor id consequat in consequat ut,"Maecenas leo odio, condimentum id, luctus nec, molestie sed, justo. Pellentesque viverra pede ac diam. Cras pellentesque volutpat dui.

Maecenas tristique, est et tempus semper, est quam pharetra magna, ac consequat metus sapien ut nunc. Vestibulum ante ipsum primis in faucibus orci luctus et ultrices posuere cubilia Curae; Mauris viverra diam vitae quam. Suspendisse potenti.

Nullam porttitor lacus at turpis. Donec posuere metus vitae ipsum. Aliquam non mauris.",261
297,"Hodkiewicz, Pollich and McClure",2,60,5,64430,posuere cubilia curae mauris viverra diam vitae quam,Phasellus in felis. Donec semper sapien a libero. Nam dui.,540
298,Blick-Schowalter,1,97,4,554,ullamcorper augue a suscipit nulla elit ac nulla,"Duis consequat dui nec nisi volutpat eleifend. Donec ut dolor. Morbi vel lectus in quam fringilla rhoncus.

Mauris enim leo, rhoncus sed, vestibulum sit amet, cursus id, turpis. Integer aliquet, massa id lobortis convallis, tortor risus dapibus augue, vel accumsan tellus nisi eu orci. Mauris lacinia sapien quis libero.

Nullam sit amet turpis elementum ligula vehicula consequat. Morbi a ipsum. Integer a nibh.",214
299,"Gerhold, Orn and Abernathy",4,47,3,34841,pellentesque ultrices mattis odio donec vitae,"Vestibulum ac est lacinia nisi venenatis tristique. Fusce congue, diam id ornare imperdiet, sapien urna pretium nisl, ut volutpat sapien arcu sed augue. Aliquam erat volutpat.

In congue. Etiam justo. Etiam pretium iaculis justo.",672
300,Beatty-Murazik,1,31,4,46871,purus eu magna vulputate luctus cum sociis,"Curabitur gravida nisi at nibh. In hac habitasse platea dictumst. Aliquam augue quam, sollicitudin vitae, consectetuer eget, rutrum at, lorem.

Integer tincidunt ante vel ipsum. Praesent blandit lacinia erat. Vestibulum sed magna at nunc commodo placerat.",991
301,Zieme LLC,5,84,5,45630,amet justo morbi ut odio cras,"Suspendisse potenti. In eleifend quam a odio. In hac habitasse platea dictumst.

Maecenas ut massa quis augue luctus tincidunt. Nulla mollis molestie lorem. Quisque ut erat.",939
302,"Satterfield, Cummerata and Dach",5,39,1,66469,vestibulum vestibulum ante ipsum primis in,"Curabitur in libero ut massa volutpat convallis. Morbi odio odio, elementum eu, interdum eu, tincidunt in, leo. Maecenas pulvinar lobortis est.",564
303,Beier-Hickle,2,62,2,373,ultrices erat tortor sollicitudin mi,"Maecenas ut massa quis augue luctus tincidunt. Nulla mollis molestie lorem. Quisque ut erat.

Curabitur gravida nisi at nibh. In hac habitasse platea dictumst. Aliquam augue quam, sollicitudin vitae, consectetuer eget, rutrum at, lorem.",227
304,"McDermott, Kulas and Considine",3,95,1,6262,nibh in lectus pellentesque at nulla suspendisse potenti,Nulla ut erat id mauris vulputate elementum. Nullam varius. Nulla facilisi.,172
305,"McGlynn, Mayer and Fadel",2,65,4,22927,eget congue eget semper rutrum nulla nunc,"Duis consequat dui nec nisi volutpat eleifend. Donec ut dolor. Morbi vel lectus in quam fringilla rhoncus.

Mauris enim leo, rhoncus sed, vestibulum sit amet, cursus id, turpis. Integer aliquet, massa id lobortis convallis, tortor risus dapibus augue, vel accumsan tellus nisi eu orci. Mauris lacinia sapien quis libero.

Nullam sit amet turpis elementum ligula vehicula consequat. Morbi a ipsum. Integer a nibh.",442
306,O'Kon-Veum,2,32,2,55805,consequat nulla nisl nunc nisl duis,"Cras mi pede, malesuada in, imperdiet et, commodo vulputate, justo. In blandit ultrices enim. Lorem ipsum dolor sit amet, consectetuer adipiscing elit.

Proin interdum mauris non ligula pellentesque ultrices. Phasellus id sapien in sapien iaculis congue. Vivamus metus arcu, adipiscing molestie, hendrerit at, vulputate vitae, nisl.

Aenean lectus. Pellentesque eget nunc. Donec quis orci eget orci vehicula condimentum.",512
307,Nitzsche LLC,3,44,4,13465,ut erat id mauris vulputate,"Curabitur at ipsum ac tellus semper interdum. Mauris ullamcorper purus sit amet nulla. Quisque arcu libero, rutrum ac, lobortis vel, dapibus at, diam.",342
308,Green-Nolan,3,90,5,20689,in faucibus orci luctus et ultrices,"Proin eu mi. Nulla ac enim. In tempor, turpis nec euismod scelerisque, quam turpis adipiscing lorem, vitae mattis nibh ligula nec sem.

Duis aliquam convallis nunc. Proin at turpis a pede posuere nonummy. Integer non velit.",711
309,Bartell-Weber,3,37,1,67927,donec ut mauris eget massa tempor convallis,"Nam ultrices, libero non mattis pulvinar, nulla pede ullamcorper augue, a suscipit nulla elit ac nulla. Sed vel enim sit amet nunc viverra dapibus. Nulla suscipit ligula in lacus.

Curabitur at ipsum ac tellus semper interdum. Mauris ullamcorper purus sit amet nulla. Quisque arcu libero, rutrum ac, lobortis vel, dapibus at, diam.",527
310,O'Conner LLC,4,80,2,19227,accumsan tellus nisi eu orci mauris,In hac habitasse platea dictumst. Etiam faucibus cursus urna. Ut tellus.,883
311,"Durgan, Funk and Harvey",3,68,2,48772,fusce consequat nulla nisl nunc,"Mauris enim leo, rhoncus sed, vestibulum sit amet, cursus id, turpis. Integer aliquet, massa id lobortis convallis, tortor risus dapibus augue, vel accumsan tellus nisi eu orci. Mauris lacinia sapien quis libero.",401
312,Beahan Inc,3,86,3,43550,potenti in eleifend quam a odio in,"Mauris enim leo, rhoncus sed, vestibulum sit amet, cursus id, turpis. Integer aliquet, massa id lobortis convallis, tortor risus dapibus augue, vel accumsan tellus nisi eu orci. Mauris lacinia sapien quis libero.",492
313,Stokes-Halvorson,3,48,1,24650,ante ipsum primis in faucibus orci luctus et,"Nulla ut erat id mauris vulputate elementum. Nullam varius. Nulla facilisi.

Cras non velit nec nisi vulputate nonummy. Maecenas tincidunt lacus at velit. Vivamus vel nulla eget eros elementum pellentesque.

Quisque porta volutpat erat. Quisque erat eros, viverra eget, congue eget, semper rutrum, nulla. Nunc purus.",704
314,Daniel-Rohan,3,61,4,78064,hac habitasse platea dictumst etiam,Etiam vel augue. Vestibulum rutrum rutrum neque. Aenean auctor gravida sem.,188
315,Turcotte and Sons,2,23,4,11533,quisque id justo sit amet sapien,Maecenas ut massa quis augue luctus tincidunt. Nulla mollis molestie lorem. Quisque ut erat.,460
316,Mueller-Walsh,3,45,4,26466,odio donec vitae nisi nam ultrices libero,"Nam ultrices, libero non mattis pulvinar, nulla pede ullamcorper augue, a suscipit nulla elit ac nulla. Sed vel enim sit amet nunc viverra dapibus. Nulla suscipit ligula in lacus.

Curabitur at ipsum ac tellus semper interdum. Mauris ullamcorper purus sit amet nulla. Quisque arcu libero, rutrum ac, lobortis vel, dapibus at, diam.",782
317,"Brown, Casper and VonRueden",3,92,2,94103,quam a odio in hac,"Curabitur gravida nisi at nibh. In hac habitasse platea dictumst. Aliquam augue quam, sollicitudin vitae, consectetuer eget, rutrum at, lorem.

Integer tincidunt ante vel ipsum. Praesent blandit lacinia erat. Vestibulum sed magna at nunc commodo placerat.

Praesent blandit. Nam nulla. Integer pede justo, lacinia eget, tincidunt eget, tempus vel, pede.",307
318,Vandervort-O'Hara,5,55,4,93622,elementum nullam varius nulla facilisi cras,"Maecenas tristique, est et tempus semper, est quam pharetra magna, ac consequat metus sapien ut nunc. Vestibulum ante ipsum primis in faucibus orci luctus et ultrices posuere cubilia Curae; Mauris viverra diam vitae quam. Suspendisse potenti.

Nullam porttitor lacus at turpis. Donec posuere metus vitae ipsum. Aliquam non mauris.",510
319,Kilback-Mraz,1,23,3,64141,in lacus curabitur at ipsum ac tellus,"Maecenas leo odio, condimentum id, luctus nec, molestie sed, justo. Pellentesque viverra pede ac diam. Cras pellentesque volutpat dui.

Maecenas tristique, est et tempus semper, est quam pharetra magna, ac consequat metus sapien ut nunc. Vestibulum ante ipsum primis in faucibus orci luctus et ultrices posuere cubilia Curae; Mauris viverra diam vitae quam. Suspendisse potenti.

Nullam porttitor lacus at turpis. Donec posuere metus vitae ipsum. Aliquam non mauris.",910
320,"Thiel, Koss and Cummings",5,30,3,10113,libero convallis eget eleifend luctus ultricies,"Praesent blandit. Nam nulla. Integer pede justo, lacinia eget, tincidunt eget, tempus vel, pede.

Morbi porttitor lorem id ligula. Suspendisse ornare consequat lectus. In est risus, auctor sed, tristique in, tempus sit amet, sem.

Fusce consequat. Nulla nisl. Nunc nisl.",190
321,Greenfelder Group,3,26,1,84134,convallis duis consequat dui nec nisi volutpat eleifend,"Maecenas tristique, est et tempus semper, est quam pharetra magna, ac consequat metus sapien ut nunc. Vestibulum ante ipsum primis in faucibus orci luctus et ultrices posuere cubilia Curae; Mauris viverra diam vitae quam. Suspendisse potenti.",379
322,Green and Sons,4,30,5,8329,nulla elit ac nulla sed vel,"Sed sagittis. Nam congue, risus semper porta volutpat, quam pede lobortis ligula, sit amet eleifend pede libero quis orci. Nullam molestie nibh in lectus.",147
323,"Swift, Stokes and Luettgen",4,50,3,66107,ornare imperdiet sapien urna pretium nisl,"Proin leo odio, porttitor id, consequat in, consequat ut, nulla. Sed accumsan felis. Ut at dolor quis odio consequat varius.

Integer ac leo. Pellentesque ultrices mattis odio. Donec vitae nisi.",963
324,Bernier LLC,3,57,4,52216,cubilia curae donec pharetra magna vestibulum aliquet,Integer ac leo. Pellentesque ultrices mattis odio. Donec vitae nisi.,324
325,"Treutel, Stroman and Parker",1,32,4,95070,elementum eu interdum eu tincidunt,Nulla ut erat id mauris vulputate elementum. Nullam varius. Nulla facilisi.,237
326,"Bednar, Klocko and Blick",1,36,1,42102,nibh ligula nec sem duis aliquam convallis nunc,Nullam sit amet turpis elementum ligula vehicula consequat. Morbi a ipsum. Integer a nibh.,536
