id,name,rating,number_of_rooms,available_rooms,price_per_night,amenities,description,place_id
484,Botsford-Collins,2,25,4,98726,consequat morbi a ipsum integer a nibh,Aenean lectus. Pellentesque eget nunc. Donec quis orci eget orci vehicula condimentum.,783
485,"DuBuque, Davis and Ritchie",4,42,1,55832,leo odio porttitor id consequat in consequat ut,"In sagittis dui vel nisl. Duis ac nibh. Fusce lacus purus, aliquet at, feugiat non, pretium quis, lectus.

Suspendisse potenti. In eleifend quam a odio. In hac habitasse platea dictumst.

Maecenas ut massa quis augue luctus tincidunt. Nulla mollis molestie lorem. Quisque ut erat.",110
486,Willms LLC,5,41,1,66555,odio odio elementum eu interdum eu,"Vestibulum ac est lacinia nisi venenatis tristique. Fusce congue, diam id ornare imperdiet, sapien urna pretium nisl, ut volutpat sapien arcu sed augue. Aliquam erat volutpat.

In congue. Etiam justo. Etiam pretium iaculis justo.",113
487,"Cole, Bins and Emard",4,100,3,85730,suspendisse ornare consequat lectus in est risus auctor,"Vestibulum quam sapien, varius ut, blandit non, interdum in, ante. Vestibulum ante ipsum primis in faucibus orci luctus et ultrices posuere cubilia Curae; Duis faucibus accumsan odio. Curabitur convallis.

Duis consequat dui nec nisi volutpat eleifend. Donec ut dolor. Morbi vel lectus in quam fringilla rhoncus.

Mauris enim leo, rhoncus sed, vestibulum sit amet, cursus id, turpis. Integer aliquet, massa id lobortis convallis, tortor risus dapibus augue, vel accumsan tellus nisi eu orci. Mauris lacinia sapien quis libero.",933
488,"Nitzsche, Tremblay and Bode",2,84,5,16407,in est risus auctor sed tristique,"Cras mi pede, malesuada in, imperdiet et, commodo vulputate, justo. In blandit ultrices enim. Lorem ipsum dolor sit amet, consectetuer adipiscing elit.

Proin interdum mauris non ligula pellentesque ultrices. Phasellus id sapien in sapien iaculis congue. Vivamus metus arcu, adipiscing molestie, hendrerit at, vulputate vitae, nisl.",77
489,Macejkovic Inc,1,97,5,88618,erat curabitur gravida nisi at nibh,Integer tincidunt ante vel ipsum. Praesent blandit lacinia erat. Vestibulum sed magna at nunc commodo placerat.,353
490,Mertz-Denesik,5,100,2,59397,nulla tempus vivamus in felis,Suspendisse potenti. In eleifend quam a odio. In hac habitasse platea dictumst.,572
491,Becker-Dach,3,69,3,48749,quis libero nullam sit amet turpis elementum,"Proin interdum mauris non ligula pellentesque ultrices. Phasellus id sapien in sapien iaculis congue. Vivamus metus arcu, adipiscing molestie, hendrerit at, vulputate vitae, nisl.

Aenean lectus. Pellentesque eget nunc. Donec quis orci eget orci vehicula condimentum.

Curabitur in libero ut massa volutpat convallis. Morbi odio odio, elementum eu, interdum eu, tincidunt in, leo. Maecenas pulvinar lobortis est.",327
492,Gerhold-Hintz,2,86,3,69090,potenti nullam porttitor lacus at turpis,In hac habitasse platea dictumst. Etiam faucibus cursus urna. Ut tellus.,527
493,Wisoky LLC,1,29,2,16814,odio consequat varius integer ac leo pellentesque,"Proin leo odio, porttitor id, consequat in, consequat ut, nulla. Sed accumsan felis. Ut at dolor quis odio consequat varius.

Integer ac leo. Pellentesque ultrices mattis odio. Donec vitae nisi.",950
494,Thiel-Kshlerin,4,22,5,30446,in lacus curabitur at ipsum ac tellus,"Fusce posuere felis sed lacus. Morbi sem mauris, laoreet ut, rhoncus aliquet, pulvinar sed, nisl. Nunc rhoncus dui vel sem.",578
495,Senger LLC,4,69,4,25028,accumsan tellus nisi eu orci mauris,"Curabitur gravida nisi at nibh. In hac habitasse platea dictumst. Aliquam augue quam, sollicitudin vitae, consectetuer eget, rutrum at, lorem.",781
496,"Rempel, Prosacco and O'Reilly",3,32,1,92590,tincidunt in leo maecenas pulvinar lobortis,Aliquam quis turpis eget elit sodales scelerisque. Mauris sit amet eros. Suspendisse accumsan tortor quis turpis.,446
497,"Heathcote, Pacocha and Hills",3,41,1,47821,dis parturient montes nascetur ridiculus mus,"Duis consequat dui nec nisi volutpat eleifend. Donec ut dolor. Morbi vel lectus in quam fringilla rhoncus.

Mauris enim leo, rhoncus sed, vestibulum sit amet, cursus id, turpis. Integer aliquet, massa id lobortis convallis, tortor risus dapibus augue, vel accumsan tellus nisi eu orci. Mauris lacinia sapien quis libero.

Nullam sit amet turpis elementum ligula vehicula consequat. Morbi a ipsum. Integer a nibh.",930
498,"Lind, Smitham and Howe",5,43,2,85251,aenean sit amet justo morbi,"Donec diam neque, vestibulum eget, vulputate ut, ultrices vel, augue. Vestibulum ante ipsum primis in faucibus orci luctus et ultrices posuere cubilia Curae; Donec pharetra, magna vestibulum aliquet ultrices, erat tortor sollicitudin mi, sit amet lobortis sapien sapien non mi. Integer ac neque.",946
499,Reichel LLC,4,98,2,60986,cras mi pede malesuada in,"Maecenas ut massa quis augue luctus tincidunt. Nulla mollis molestie lorem. Quisque ut erat.

Curabitur gravida nisi at nibh. In hac habitasse platea dictumst. Aliquam augue quam, sollicitudin vitae, consectetuer eget, rutrum at, lorem.",536
500,Flatley-Powlowski,4,37,1,50851,turpis eget elit sodales scelerisque mauris,"Curabitur in libero ut massa volutpat convallis. Morbi odio odio, elementum eu, interdum eu, tincidunt in, leo. Maecenas pulvinar lobortis est.

Phasellus sit amet erat. Nulla tempus. Vivamus in felis eu sapien cursus vestibulum.",701
501,"Kulas, Heathcote and Huels",5,23,4,98477,nec nisi vulputate nonummy maecenas,"Duis consequat dui nec nisi volutpat eleifend. Donec ut dolor. Morbi vel lectus in quam fringilla rhoncus.

Mauris enim leo, rhoncus sed, vestibulum sit amet, cursus id, turpis. Integer aliquet, massa id lobortis convallis, tortor risus dapibus augue, vel accumsan tellus nisi eu orci. Mauris lacinia sapien quis libero.

Nullam sit amet turpis elementum ligula vehicula consequat. Morbi a ipsum. Integer a nibh.",80
502,Wuckert-Pollich,1,22,3,90228,amet turpis elementum ligula vehicula consequat morbi,"Proin leo odio, porttitor id, consequat in, consequat ut, nulla. Sed accumsan felis. Ut at dolor quis odio consequat varius.",318
503,Barton LLC,1,61,3,65530,pellentesque eget nunc donec quis orci eget,"Mauris enim leo, rhoncus sed, vestibulum sit amet, cursus id, turpis. Integer aliquet, massa id lobortis convallis, tortor risus dapibus augue, vel accumsan tellus nisi eu orci. Mauris lacinia sapien quis libero.

Nullam sit amet turpis elementum ligula vehicula consequat. Morbi a ipsum. Integer a nibh.",496
504,Hickle-Kiehn,3,69,4,23109,leo maecenas pulvinar lobortis est,"Phasellus in felis. Donec semper sapien a libero. Nam dui.

Proin leo odio, porttitor id, consequat in, consequat ut, nulla. Sed accumsan felis. Ut at dolor quis odio consequat varius.

Integer ac leo. Pellentesque ultrices mattis odio. Donec vitae nisi.",870
505,Sipes-Dicki,4,56,1,83089,ipsum praesent blandit lacinia erat vestibulum sed magna,"In hac habitasse platea dictumst. Etiam faucibus cursus urna. Ut tellus.

Nulla ut erat id mauris vulputate elementum. Nullam varius. Nulla facilisi.

Cras non velit nec nisi vulputate nonummy. Maecenas tincidunt lacus at velit. Vivamus vel nulla eget eros elementum pellentesque.",274
506,"Jacobson, Kutch and Emard",4,29,3,98657,tincidunt nulla mollis molestie lorem quisque ut erat,"Vestibulum quam sapien, varius ut, blandit non, interdum in, ante. Vestibulum ante ipsum primis in faucibus orci luctus et ultrices posuere cubilia Curae; Duis faucibus accumsan odio. Curabitur convallis.

Duis consequat dui nec nisi volutpat eleifend. Donec ut dolor. Morbi vel lectus in quam fringilla rhoncus.",294
507,"Abernathy, Klocko and Runolfsdottir",2,26,5,32875,purus phasellus in felis donec,Nulla ut erat id mauris vulputate elementum. Nullam varius. Nulla facilisi.,923
508,"Jakubowski, Wuckert and Wisozk",2,42,3,74137,ipsum primis in faucibus orci luctus et,"Proin eu mi. Nulla ac enim. In tempor, turpis nec euismod scelerisque, quam turpis adipiscing lorem, vitae mattis nibh ligula nec sem.",549
509,Cassin LLC,1,34,2,77082,odio porttitor id consequat in consequat,Praesent id massa id nisl venenatis lacinia. Aenean sit amet justo. Morbi ut odio.,629
510,"Schumm, Sawayn and Rodriguez",3,25,4,81069,tortor id nulla ultrices aliquet maecenas leo,Etiam vel augue. Vestibulum rutrum rutrum neque. Aenean auctor gravida sem.,272
511,Gibson-Koelpin,2,87,2,63786,augue a suscipit nulla elit ac,"Cum sociis natoque penatibus et magnis dis parturient montes, nascetur ridiculus mus. Vivamus vestibulum sagittis sapien. Cum sociis natoque penatibus et magnis dis parturient montes, nascetur ridiculus mus.",203
512,"Kautzer, Terry and Raynor",1,95,4,71860,mauris lacinia sapien quis libero nullam sit amet,"Praesent id massa id nisl venenatis lacinia. Aenean sit amet justo. Morbi ut odio.

Cras mi pede, malesuada in, imperdiet et, commodo vulputate, justo. In blandit ultrices enim. Lorem ipsum dolor sit amet, consectetuer adipiscing elit.

Proin interdum mauris non ligula pellentesque ultrices. Phasellus id sapien in sapien iaculis congue. Vivamus metus arcu, adipiscing molestie, hendrerit at, vulputate vitae, nisl.",414
513,"Wyman, Fay and O'Conner",1,20,5,52293,habitasse platea dictumst morbi vestibulum velit,"In congue. Etiam justo. Etiam pretium iaculis justo.

In hac habitasse platea dictumst. Etiam faucibus cursus urna. Ut tellus.",18
514,DuBuque-Torphy,2,38,3,40200,accumsan tellus nisi eu orci mauris lacinia,"Duis bibendum, felis sed interdum venenatis, turpis enim blandit mi, in porttitor pede justo eu massa. Donec dapibus. Duis at velit eu est congue elementum.",78
515,"Wilderman, Heathcote and Bechtelar",2,33,1,80601,quisque arcu libero rutrum ac lobortis,"Cum sociis natoque penatibus et magnis dis parturient montes, nascetur ridiculus mus. Vivamus vestibulum sagittis sapien. Cum sociis natoque penatibus et magnis dis parturient montes, nascetur ridiculus mus.

Etiam vel augue. Vestibulum rutrum rutrum neque. Aenean auctor gravida sem.

Praesent id massa id nisl venenatis lacinia. Aenean sit amet justo. Morbi ut odio.",37
516,Gleason LLC,4,78,1,36773,volutpat in congue etiam justo etiam pretium iaculis,"Maecenas tristique, est et tempus semper, est quam pharetra magna, ac consequat metus sapien ut nunc. Vestibulum ante ipsum primis in faucibus orci luctus et ultrices posuere cubilia Curae; Mauris viverra diam vitae quam. Suspendisse potenti.

Nullam porttitor lacus at turpis. Donec posuere metus vitae ipsum. Aliquam non mauris.

Morbi non lectus. Aliquam sit amet diam in magna bibendum imperdiet. Nullam orci pede, venenatis non, sodales sed, tincidunt eu, felis.",362
517,Hansen and Sons,4,25,1,47823,felis fusce posuere felis sed,"Cras non velit nec nisi vulputate nonummy. Maecenas tincidunt lacus at velit. Vivamus vel nulla eget eros elementum pellentesque.

Quisque porta volutpat erat. Quisque erat eros, viverra eget, congue eget, semper rutrum, nulla. Nunc purus.

Phasellus in felis. Donec semper sapien a libero. Nam dui.",902
518,"Mayer, Ernser and Mitchell",4,69,2,98863,arcu libero rutrum ac lobortis vel dapibus at,"Etiam vel augue. Vestibulum rutrum rutrum neque. Aenean auctor gravida sem.

Praesent id massa id nisl venenatis lacinia. Aenean sit amet justo. Morbi ut odio.",292
519,Barrows-Quigley,4,91,1,13435,sed tristique in tempus sit amet sem,"Cum sociis natoque penatibus et magnis dis parturient montes, nascetur ridiculus mus. Vivamus vestibulum sagittis sapien. Cum sociis natoque penatibus et magnis dis parturient montes, nascetur ridiculus mus.",72
520,Miller-Rice,2,99,1,92109,donec semper sapien a libero nam dui,"Quisque porta volutpat erat. Quisque erat eros, viverra eget, congue eget, semper rutrum, nulla. Nunc purus.

Phasellus in felis. Donec semper sapien a libero. Nam dui.

Proin leo odio, porttitor id, consequat in, consequat ut, nulla. Sed accumsan felis. Ut at dolor quis odio consequat varius.",173
521,Fadel Group,5,49,5,61257,lacus curabitur at ipsum ac tellus semper interdum,"Duis bibendum. Morbi non quam nec dui luctus rutrum. Nulla tellus.

In sagittis dui vel nisl. Duis ac nibh. Fusce lacus purus, aliquet at, feugiat non, pretium quis, lectus.

Suspendisse potenti. In eleifend quam a odio. In hac habitasse platea dictumst.",600
522,Bruen Group,3,59,4,43371,amet nunc viverra dapibus nulla suscipit ligula in,"Fusce consequat. Nulla nisl. Nunc nisl.

Duis bibendum, felis sed interdum venenatis, turpis enim blandit mi, in porttitor pede justo eu massa. Donec dapibus. Duis at velit eu est congue elementum.",62
523,"Weimann, Rodriguez and Reichert",3,45,1,43713,mattis pulvinar nulla pede ullamcorper augue,"Sed sagittis. Nam congue, risus semper porta volutpat, quam pede lobortis ligula, sit amet eleifend pede libero quis orci. Nullam molestie nibh in lectus.

Pellentesque at nulla. Suspendisse potenti. Cras in purus eu magna vulputate luctus.",9
524,Hammes Group,4,41,3,18696,primis in faucibus orci luctus et,Integer tincidunt ante vel ipsum. Praesent blandit lacinia erat. Vestibulum sed magna at nunc commodo placerat.,330
525,"Hills, Windler and Heidenreich",5,56,4,96620,est quam pharetra magna ac consequat,"Nulla ut erat id mauris vulputate elementum. Nullam varius. Nulla facilisi.

Cras non velit nec nisi vulputate nonummy. Maecenas tincidunt lacus at velit. Vivamus vel nulla eget eros elementum pellentesque.",757
526,Brown LLC,4,84,1,71647,nulla suspendisse potenti cras in,"In hac habitasse platea dictumst. Etiam faucibus cursus urna. Ut tellus.

Nulla ut erat id mauris vulputate elementum. Nullam varius. Nulla facilisi.

Cras non velit nec nisi vulputate nonummy. Maecenas tincidunt lacus at velit. Vivamus vel nulla eget eros elementum pellentesque.",107
527,Stanton-Lueilwitz,1,51,1,60227,felis donec semper sapien a libero nam dui,"Cras mi pede, malesuada in, imperdiet et, commodo vulputate, justo. In blandit ultrices enim. Lorem ipsum dolor sit amet, consectetuer adipiscing elit.

Proin interdum mauris non ligula pellentesque ultrices. Phasellus id sapien in sapien iaculis congue. Vivamus metus arcu, adipiscing molestie, hendrerit at, vulputate vitae, nisl.",291
528,Paucek-Hilll,4,28,1,73331,nunc viverra dapibus nulla suscipit ligula,"Quisque id justo sit amet sapien dignissim vestibulum. Vestibulum ante ipsum primis in faucibus orci luctus et ultrices posuere cubilia Curae; Nulla dapibus dolor vel est. Donec odio justo, sollicitudin ut, suscipit a, feugiat et, eros.",214
529,Heller Inc,1,85,1,51035,mauris enim leo rhoncus sed vestibulum,Praesent id massa id nisl venenatis lacinia. Aenean sit amet justo. Morbi ut odio.,704
530,"Turner, Sawayn and Spinka",2,71,4,92415,diam erat fermentum justo nec condimentum neque,"Vestibulum ac est lacinia nisi venenatis tristique. Fusce congue, diam id ornare imperdiet, sapien urna pretium nisl, ut volutpat sapien arcu sed augue. Aliquam erat volutpat.

In congue. Etiam justo. Etiam pretium iaculis justo.",463
531,"Miller, Carter and Senger",3,41,5,7523,erat fermentum justo nec condimentum,"Curabitur in libero ut massa volutpat convallis. Morbi odio odio, elementum eu, interdum eu, tincidunt in, leo. Maecenas pulvinar lobortis est.

Phasellus sit amet erat. Nulla tempus. Vivamus in felis eu sapien cursus vestibulum.

Proin eu mi. Nulla ac enim. In tempor, turpis nec euismod scelerisque, quam turpis adipiscing lorem, vitae mattis nibh ligula nec sem.",345
532,Fahey Inc,4,80,2,94417,habitasse platea dictumst morbi vestibulum velit id,"Integer ac leo. Pellentesque ultrices mattis odio. Donec vitae nisi.

Nam ultrices, libero non mattis pulvinar, nulla pede ullamcorper augue, a suscipit nulla elit ac nulla. Sed vel enim sit amet nunc viverra dapibus. Nulla suscipit ligula in lacus.",402
533,"Herzog, Nolan and Braun",1,29,5,20526,cubilia curae duis faucibus accumsan odio curabitur convallis,In hac habitasse platea dictumst. Etiam faucibus cursus urna. Ut tellus.,627
534,"Ryan, Towne and Veum",4,50,2,59911,erat volutpat in congue etiam justo,"Curabitur gravida nisi at nibh. In hac habitasse platea dictumst. Aliquam augue quam, sollicitudin vitae, consectetuer eget, rutrum at, lorem.",647
535,"Fisher, Kovacek and Graham",4,52,1,70224,hac habitasse platea dictumst aliquam augue quam,"Cum sociis natoque penatibus et magnis dis parturient montes, nascetur ridiculus mus. Vivamus vestibulum sagittis sapien. Cum sociis natoque penatibus et magnis dis parturient montes, nascetur ridiculus mus.

Etiam vel augue. Vestibulum rutrum rutrum neque. Aenean auctor gravida sem.",677
536,"Nader, Kris and Jakubowski",4,30,5,74817,sapien cursus vestibulum proin eu mi nulla ac,"Maecenas tristique, est et tempus semper, est quam pharetra magna, ac consequat metus sapien ut nunc. Vestibulum ante ipsum primis in faucibus orci luctus et ultrices posuere cubilia Curae; Mauris viverra diam vitae quam. Suspendisse potenti.",934
537,Legros Inc,1,98,5,25073,sit amet eros suspendisse accumsan tortor quis,"Nullam porttitor lacus at turpis. Donec posuere metus vitae ipsum. Aliquam non mauris.

Morbi non lectus. Aliquam sit amet diam in magna bibendum imperdiet. Nullam orci pede, venenatis non, sodales sed, tincidunt eu, felis.",639
538,Windler and Sons,2,86,5,36733,eget eleifend luctus ultricies eu,"Quisque porta volutpat erat. Quisque erat eros, viverra eget, congue eget, semper rutrum, nulla. Nunc purus.

Phasellus in felis. Donec semper sapien a libero. Nam dui.

Proin leo odio, porttitor id, consequat in, consequat ut, nulla. Sed accumsan felis. Ut at dolor quis odio consequat varius.",474
539,"Lindgren, Monahan and Ondricka",1,63,2,79494,ac neque duis bibendum morbi non,"In congue. Etiam justo. Etiam pretium iaculis justo.

In hac habitasse platea dictumst. Etiam faucibus cursus urna. Ut tellus.

Nulla ut erat id mauris vulputate elementum. Nullam varius. Nulla facilisi.",477
540,"Jerde, Grant and Tillman",1,49,2,33438,consequat in consequat ut nulla sed accumsan,"Maecenas tristique, est et tempus semper, est quam pharetra magna, ac consequat metus sapien ut nunc. Vestibulum ante ipsum primis in faucibus orci luctus et ultrices posuere cubilia Curae; Mauris viverra diam vitae quam. Suspendisse potenti.",526
541,Stehr and Sons,3,38,5,89309,sit amet consectetuer adipiscing elit,Nullam sit amet turpis elementum ligula vehicula consequat. Morbi a ipsum. Integer a nibh.,287
542,Rowe LLC,2,55,2,43915,eget rutrum at lorem integer tincidunt ante vel,"In hac habitasse platea dictumst. Morbi vestibulum, velit id pretium iaculis, diam erat fermentum justo, nec condimentum neque sapien placerat ante. Nulla justo.

Aliquam quis turpis eget elit sodales scelerisque. Mauris sit amet eros. Suspendisse accumsan tortor quis turpis.",352
543,Welch and Sons,2,74,1,23216,id massa id nisl venenatis lacinia,"Aenean fermentum. Donec ut mauris eget massa tempor convallis. Nulla neque libero, convallis eget, eleifend luctus, ultricies eu, nibh.",486
544,Pollich-Kuhlman,1,39,2,91980,in porttitor pede justo eu,"Suspendisse potenti. In eleifend quam a odio. In hac habitasse platea dictumst.

Maecenas ut massa quis augue luctus tincidunt. Nulla mollis molestie lorem. Quisque ut erat.

Curabitur gravida nisi at nibh. In hac habitasse platea dictumst. Aliquam augue quam, sollicitudin vitae, consectetuer eget, rutrum at, lorem.",858
545,"Pfannerstill, Boehm and Dicki",2,67,1,30388,quis orci nullam molestie nibh,"Vestibulum ac est lacinia nisi venenatis tristique. Fusce congue, diam id ornare imperdiet, sapien urna pretium nisl, ut volutpat sapien arcu sed augue. Aliquam erat volutpat.",836
546,Reilly and Sons,2,34,4,48300,ac nibh fusce lacus purus aliquet at,"Quisque porta volutpat erat. Quisque erat eros, viverra eget, congue eget, semper rutrum, nulla. Nunc purus.

Phasellus in felis. Donec semper sapien a libero. Nam dui.",75
547,Davis-Mayert,2,60,5,50418,quam sapien varius ut blandit non,Duis aliquam convallis nunc. Proin at turpis a pede posuere nonummy. Integer non velit.,524
548,Hermann Group,4,94,3,36742,lacus morbi sem mauris laoreet ut rhoncus,"Nullam porttitor lacus at turpis. Donec posuere metus vitae ipsum. Aliquam non mauris.

Morbi non lectus. Aliquam sit amet diam in magna bibendum imperdiet. Nullam orci pede, venenatis non, sodales sed, tincidunt eu, felis.",209
549,Dickinson Inc,5,80,4,68506,volutpat dui maecenas tristique est et,"Aenean fermentum. Donec ut mauris eget massa tempor convallis. Nulla neque libero, convallis eget, eleifend luctus, ultricies eu, nibh.

Quisque id justo sit amet sapien dignissim vestibulum. Vestibulum ante ipsum primis in faucibus orci luctus et ultrices posuere cubilia Curae; Nulla dapibus dolor vel est. Donec odio justo, sollicitudin ut, suscipit a, feugiat et, eros.",948
550,Wyman-Muller,4,96,5,16873,magna at nunc commodo placerat,"Maecenas leo odio, condimentum id, luctus nec, molestie sed, justo. Pellentesque viverra pede ac diam. Cras pellentesque volutpat dui.

Maecenas tristique, est et tempus semper, est quam pharetra magna, ac consequat metus sapien ut nunc. Vestibulum ante ipsum primis in faucibus orci luctus et ultrices posuere cubilia Curae; Mauris viverra diam vitae quam. Suspendisse potenti.

Nullam porttitor lacus at turpis. Donec posuere metus vitae ipsum. Aliquam non mauris.",204
551,Champlin-McKenzie,4,77,1,50229,curae duis faucibus accumsan odio curabitur,"Duis aliquam convallis nunc. Proin at turpis a pede posuere nonummy. Integer non velit.

Donec diam neque, vestibulum eget, vulputate ut, ultrices vel, augue. Vestibulum ante ipsum primis in faucibus orci luctus et ultrices posuere cubilia Curae; Donec pharetra, magna vestibulum aliquet ultrices, erat tortor sollicitudin mi, sit amet lobortis sapien sapien non mi. Integer ac neque.

Duis bibendum. Morbi non quam nec dui luctus rutrum. Nulla tellus.",360
552,Kutch-Abbott,1,49,2,77142,pulvinar sed nisl nunc rhoncus dui vel,"Aenean fermentum. Donec ut mauris eget massa tempor convallis. Nulla neque libero, convallis eget, eleifend luctus, ultricies eu, nibh.

Quisque id justo sit amet sapien dignissim vestibulum. Vestibulum ante ipsum primis in faucibus orci luctus et ultrices posuere cubilia Curae; Nulla dapibus dolor vel est. Donec odio justo, sollicitudin ut, suscipit a, feugiat et, eros.

Vestibulum ac est lacinia nisi venenatis tristique. Fusce congue, diam id ornare imperdiet, sapien urna pretium nisl, ut volutpat sapien arcu sed augue. Aliquam erat volutpat.",103
553,"Mante, Shanahan and Schinner",4,84,5,84884,et ultrices posuere cubilia curae nulla,"Lorem ipsum dolor sit amet, consectetuer adipiscing elit. Proin risus. Praesent lectus.",553
554,Towne LLC,2,32,4,32286,leo rhoncus sed vestibulum sit amet cursus,"Morbi non lectus. Aliquam sit amet diam in magna bibendum imperdiet. Nullam orci pede, venenatis non, sodales sed, tincidunt eu, felis.

Fusce posuere felis sed lacus. Morbi sem mauris, laoreet ut, rhoncus aliquet, pulvinar sed, nisl. Nunc rhoncus dui vel sem.",409
555,Jakubowski-Fahey,2,35,2,59106,cubilia curae mauris viverra diam vitae,"Aenean fermentum. Donec ut mauris eget massa tempor convallis. Nulla neque libero, convallis eget, eleifend luctus, ultricies eu, nibh.

Quisque id justo sit amet sapien dignissim vestibulum. Vestibulum ante ipsum primis in faucibus orci luctus et ultrices posuere cubilia Curae; Nulla dapibus dolor vel est. Donec odio justo, sollicitudin ut, suscipit a, feugiat et, eros.",481
556,Grady Inc,1,60,3,4944,ultrices mattis odio donec vitae nisi nam,Phasellus in felis. Donec semper sapien a libero. Nam dui.,438
557,Smith Inc,3,35,5,86534,ut rhoncus aliquet pulvinar sed,"Pellentesque at nulla. Suspendisse potenti. Cras in purus eu magna vulputate luctus.

Cum sociis natoque penatibus et magnis dis parturient montes, nascetur ridiculus mus. Vivamus vestibulum sagittis sapien. Cum sociis natoque penatibus et magnis dis parturient montes, nascetur ridiculus mus.

Etiam vel augue. Vestibulum rutrum rutrum neque. Aenean auctor gravida sem.",254
558,Harvey-Rempel,4,36,1,2852,neque duis bibendum morbi non quam,"Quisque id justo sit amet sapien dignissim vestibulum. Vestibulum ante ipsum primis in faucibus orci luctus et ultrices posuere cubilia Curae; Nulla dapibus dolor vel est. Donec odio justo, sollicitudin ut, suscipit a, feugiat et, eros.

Vestibulum ac est lacinia nisi venenatis tristique. Fusce congue, diam id ornare imperdiet, sapien urna pretium nisl, ut volutpat sapien arcu sed augue. Aliquam erat volutpat.",211
559,"Hessel, Parker and Powlowski",2,27,5,56795,ligula vehicula consequat morbi a ipsum integer,"Praesent id massa id nisl venenatis lacinia. Aenean sit amet justo. Morbi ut odio.

Cras mi pede, malesuada in, imperdiet et, commodo vulputate, justo. In blandit ultrices enim. Lorem ipsum dolor sit amet, consectetuer adipiscing elit.

Proin interdum mauris non ligula pellentesque ultrices. Phasellus id sapien in sapien iaculis congue. Vivamus metus arcu, adipiscing molestie, hendrerit at, vulputate vitae, nisl.",22
560,"Hirthe, Purdy and Schmitt",1,21,2,85544,vel est donec odio justo,"Fusce posuere felis sed lacus. Morbi sem mauris, laoreet ut, rhoncus aliquet, pulvinar sed, nisl. Nunc rhoncus dui vel sem.",570
561,Wiegand and Sons,4,82,3,94129,magna vestibulum aliquet ultrices erat tortor sollicitudin mi,"Praesent id massa id nisl venenatis lacinia. Aenean sit amet justo. Morbi ut odio.

Cras mi pede, malesuada in, imperdiet et, commodo vulputate, justo. In blandit ultrices enim. Lorem ipsum dolor sit amet, consectetuer adipiscing elit.

Proin interdum mauris non ligula pellentesque ultrices. Phasellus id sapien in sapien iaculis congue. Vivamus metus arcu, adipiscing molestie, hendrerit at, vulputate vitae, nisl.",59
562,Boyer-Cormier,2,91,2,98453,suspendisse potenti in eleifend quam a,Maecenas ut massa quis augue luctus tincidunt. Nulla mollis molestie lorem. Quisque ut erat.,314
